{
  "schema_version": 1,
  "task_kind": "test_quality",
  "source": {
    "workspace": "example_org_example_repo_v1_v2",
    "milestone_id": "M100",
    "input_hash": "cccccccccccccccccccccccccccccccccccccccccccccccccccccccccccccccc"
  },
  "status": "reviewed",
  "decisions_file": "test_decisions_valid.jsonl",
  "decisions_sha256": "ac5a0b85018b9274010679f860517ed36263547f47af530879fd0af71134c457",
  "decision_count": 3,
  "additions": [
    {
      "test_id": "tests::missing_beta",
      "role": "n2p",
      "target_requirement_ids": ["FR-3"],
      "rationale": "No effective test covers the beta error path.",
      "evidence": [
        {"kind": "coverage", "reference": "tests.jsonl", "detail": "No effective test invokes the beta error path."}
      ],
      "provenance": {
        "kind": "synthesized",
        "path": "tests/test_beta.py",
        "test_name": "test_beta_error",
        "behavior": "Verifies that an invalid beta value returns the documented error."
      }
    }
  ],
  "summary": {
    "keep_direct_target": 1,
    "keep_regression": 1,
    "reclassify": 1,
    "remove_unrelated": 0,
    "remove_flaky": 0,
    "needs_human": 0
  },
  "notes": []
}
